<?xml version="1.0" encoding="UTF-8"?>
<?xml-stylesheet type="text/xsl" href="../xsl/recipes.xsl"?>
<!DOCTYPE recipeData SYSTEM "../recipes.dtd">
<recipeData xmlns:xsi="http://www.w3.org/2001/XMLSchema-instance"
            xsi:noNamespaceSchemaLocation="../recipes.xsd">
    <recipes>
        <recipe id="r1">
            <title>Spaghetti Carbonara</title>
            <description>Classic Italian pasta dish with eggs, cheese, pancetta, and black pepper. A creamy and delicious comfort food.</description>
            <cuisineTypes>
                <cuisine>Italian</cuisine>
                <cuisine>European</cuisine>
            </cuisineTypes>
            <difficultyLevel>Intermediate</difficultyLevel>
            <cookingTime>30 minutes</cookingTime>
            <servings>4</servings>
            <ingredients>
                <ingredient>400g spaghetti</ingredient>
                <ingredient>200g pancetta or guanciale, diced</ingredient>
                <ingredient>4 large eggs</ingredient>
                <ingredient>100g Pecorino Romano cheese, grated</ingredient>
                <ingredient>Black pepper, freshly ground</ingredient>
                <ingredient>Salt</ingredient>
            </ingredients>
            <instructions>
                <step>Bring a large pot of salted water to a boil and cook spaghetti according to package directions until al dente.</step>
                <step>While pasta cooks, heat a large pan over medium heat and cook pancetta until crispy, about 5-7 minutes.</step>
                <step>In a bowl, whisk together eggs, grated cheese, and a generous amount of black pepper.</step>
                <step>Drain pasta, reserving 1 cup of pasta water. Add hot pasta to the pan with pancetta, remove from heat.</step>
                <step>Quickly pour the egg mixture over the pasta, tossing constantly. Add pasta water as needed to create a creamy sauce.</step>
                <step>Serve immediately with extra cheese and black pepper on top.</step>
            </instructions>
        </recipe>
        <recipe id="r2">
            <title>Chicken Tikka Masala</title>
            <description>Rich and creamy Indian curry with tender chicken pieces in a spiced tomato-based sauce.</description>
            <cuisineTypes>
                <cuisine>Indian</cuisine>
                <cuisine>Asian</cuisine>
            </cuisineTypes>
            <difficultyLevel>Advanced</difficultyLevel>
            <cookingTime>60 minutes</cookingTime>
            <servings>4</servings>
            <ingredients>
                <ingredient>500g chicken breast, cubed</ingredient>
                <ingredient>1 cup plain yogurt</ingredient>
                <ingredient>2 tbsp garam masala</ingredient>
                <ingredient>1 can (400g) crushed tomatoes</ingredient>
                <ingredient>1 cup heavy cream</ingredient>
                <ingredient>1 onion, diced</ingredient>
                <ingredient>3 cloves garlic, minced</ingredient>
                <ingredient>1 inch ginger, grated</ingredient>
                <ingredient>2 tbsp vegetable oil</ingredient>
                <ingredient>Salt and pepper to taste</ingredient>
            </ingredients>
            <instructions>
                <step>Marinate chicken in yogurt and half the garam masala for at least 30 minutes.</step>
                <step>Heat oil in a large pan and cook chicken until browned, then set aside.</step>
                <step>In the same pan, sauté onions until soft, then add garlic and ginger.</step>
                <step>Add remaining garam masala and cook for 1 minute until fragrant.</step>
                <step>Add crushed tomatoes and simmer for 10 minutes.</step>
                <step>Return chicken to pan, add cream, and simmer for 15 minutes.</step>
                <step>Season with salt and pepper. Serve with rice or naan.</step>
            </instructions>
        </recipe>
        <recipe id="r3">
            <title>Caesar Salad</title>
            <description>Fresh romaine lettuce with homemade Caesar dressing, croutons, and parmesan cheese. A classic salad that's easy to make.</description>
            <cuisineTypes>
                <cuisine>American</cuisine>
                <cuisine>Mediterranean</cuisine>
            </cuisineTypes>
            <difficultyLevel>Beginner</difficultyLevel>
            <cookingTime>15 minutes</cookingTime>
            <servings>4</servings>
            <ingredients>
                <ingredient>2 heads romaine lettuce, chopped</ingredient>
                <ingredient>1/2 cup parmesan cheese, grated</ingredient>
                <ingredient>1 cup croutons</ingredient>
                <ingredient>3 cloves garlic, minced</ingredient>
                <ingredient>2 anchovy fillets</ingredient>
                <ingredient>1/4 cup olive oil</ingredient>
                <ingredient>2 tbsp lemon juice</ingredient>
                <ingredient>1 tsp Dijon mustard</ingredient>
                <ingredient>Salt and pepper to taste</ingredient>
            </ingredients>
            <instructions>
                <step>Wash and dry romaine lettuce, then chop into bite-sized pieces.</step>
                <step>In a small bowl, mash anchovies and garlic together. Whisk in olive oil, lemon juice, and Dijon mustard.</step>
                <step>Season dressing with salt and pepper to taste.</step>
                <step>In a large bowl, toss lettuce with dressing until well coated.</step>
                <step>Add croutons and parmesan cheese, toss gently.</step>
                <step>Serve immediately.</step>
            </instructions>
        </recipe>
        <recipe id="r4">
            <title>Beef Stroganoff</title>
            <description>Classic Russian dish with tender beef strips in a rich sour cream sauce, served over egg noodles.</description>
            <cuisineTypes>
                <cuisine>Russian</cuisine>
                <cuisine>European</cuisine>
            </cuisineTypes>
            <difficultyLevel>Intermediate</difficultyLevel>
            <cookingTime>45 minutes</cookingTime>
            <servings>4</servings>
            <ingredients>
                <ingredient>500g beef sirloin, sliced into strips</ingredient>
                <ingredient>1 onion, sliced</ingredient>
                <ingredient>200g mushrooms, sliced</ingredient>
                <ingredient>1 cup beef broth</ingredient>
                <ingredient>1/2 cup sour cream</ingredient>
                <ingredient>2 tbsp flour</ingredient>
                <ingredient>2 tbsp butter</ingredient>
                <ingredient>Salt and pepper to taste</ingredient>
                <ingredient>Egg noodles for serving</ingredient>
            </ingredients>
            <instructions>
                <step>Season beef strips with salt and pepper, then dust with flour.</step>
                <step>Heat butter in a large pan and brown beef strips, then remove and set aside.</step>
                <step>In the same pan, cook onions until soft, then add mushrooms.</step>
                <step>Add beef broth and bring to a simmer, scraping up browned bits.</step>
                <step>Return beef to pan and simmer for 10 minutes.</step>
                <step>Stir in sour cream and heat through without boiling.</step>
                <step>Serve over cooked egg noodles.</step>
            </instructions>
        </recipe>
        <recipe id="r5">
            <title>Sushi Rolls</title>
            <description>Traditional Japanese sushi rolls with fresh fish, rice, and vegetables. Requires practice to perfect.</description>
            <cuisineTypes>
                <cuisine>Japanese</cuisine>
                <cuisine>Asian</cuisine>
            </cuisineTypes>
            <difficultyLevel>Advanced</difficultyLevel>
            <cookingTime>90 minutes</cookingTime>
            <servings>4</servings>
            <ingredients>
                <ingredient>2 cups sushi rice</ingredient>
                <ingredient>1/4 cup rice vinegar</ingredient>
                <ingredient>2 tbsp sugar</ingredient>
                <ingredient>4 nori sheets</ingredient>
                <ingredient>200g fresh salmon or tuna, sliced</ingredient>
                <ingredient>1 cucumber, julienned</ingredient>
                <ingredient>1 avocado, sliced</ingredient>
                <ingredient>Soy sauce and wasabi for serving</ingredient>
            </ingredients>
            <instructions>
                <step>Cook sushi rice according to package directions. Mix with rice vinegar and sugar while warm.</step>
                <step>Let rice cool to room temperature.</step>
                <step>Place nori sheet on a bamboo mat, shiny side down.</step>
                <step>Spread a thin layer of rice over nori, leaving 1 inch at the top.</step>
                <step>Arrange fish and vegetables in a line across the rice.</step>
                <step>Roll tightly using the bamboo mat, pressing firmly.</step>
                <step>Slice into 8 pieces with a sharp, wet knife.</step>
                <step>Serve with soy sauce and wasabi.</step>
            </instructions>
        </recipe>
        <recipe id="r6">
            <title>Margherita Pizza</title>
            <description>Simple and classic Italian pizza with fresh tomatoes, mozzarella, and basil. The perfect combination of flavors.</description>
            <cuisineTypes>
                <cuisine>Italian</cuisine>
                <cuisine>Mediterranean</cuisine>
            </cuisineTypes>
            <difficultyLevel>Beginner</difficultyLevel>
            <cookingTime>20 minutes</cookingTime>
            <servings>2-3</servings>
            <ingredients>
                <ingredient>1 pizza dough (store-bought or homemade)</ingredient>
                <ingredient>1/2 cup tomato sauce</ingredient>
                <ingredient>200g fresh mozzarella, sliced</ingredient>